{
  "schema_version": 2,
  "id": "monitoring.roster-guard",
  "title": "Cron roster semantic guard",
  "domain": "monitoring",
  "enabled": true,
  "schedule": {
    "cron": "*/5 * * * *",
    "timezone": "America/Los_Angeles"
  },
  "runtime": {
    "scheduler": "Hermes Agent cron (optional wrapper)",
    "execution_mode": "script/no-agent",
    "kind": "script",
    "uses_llm": false,
    "model_attached": false,
    "model": null,
    "portable_to": [
      "Hermes Agent cron in no-agent mode",
      "another scheduler that can inspect the Hermes job store"
    ]
  },
  "inputs": [
    "scheduler metadata with private values removed",
    "latest bounded output receipts"
  ],
  "outputs": [
    "healthy/broken transition alert",
    "monitor heartbeat"
  ],
  "risk": {
    "level": "monitoring-write",
    "confirmation": "may update local monitor state and send transition alerts only"
  },
  "verification": [
    "required names/schedules/runtimes/delivery contracts match",
    "intentional pauses are explicit",
    "weekend schedules do not false-alarm",
    "latest outputs satisfy format contracts"
  ],
  "logging": {
    "receipt": "one bounded per-run receipt",
    "retention": "operator-defined local retention",
    "business_verification_required": true
  },
  "failure_policy": {
    "deliver_every_run": false,
    "mode": "transition-alert",
    "never_infer_success": true
  },
  "secrets_policy": "monitor tokens and delivery destinations remain local",
  "output_format": {
    "delivery": "plain-text transition alert + private heartbeat",
    "template": "output.md",
    "exact_contract": true,
    "always_reports": false
  },
  "limitations": [
    "This watches one specific job roster; copied names, schedules, and required jobs need to be replaced.",
    "Scheduler status ok is not proof that a job produced a correct business result.",
    "Transition-only delivery can hide a dead monitor unless a separate heartbeat watches the watcher."
  ],
  "copying": {
    "ready_to_run": false,
    "requires": [
      "your required roster contract",
      "access to scheduler metadata and receipts",
      "a private state file",
      "a separate heartbeat monitor"
    ]
  }
}
