{
  "schema_version": 2,
  "id": "goodreads.daily-reading-annotations",
  "title": "Goodreads daily reading + annotations",
  "domain": "goodreads",
  "enabled": true,
  "schedule": {
    "cron": "0 3 * * *",
    "timezone": "America/Los_Angeles"
  },
  "runtime": {
    "scheduler": "Hermes Agent cron (optional wrapper)",
    "execution_mode": "script/no-agent",
    "kind": "script",
    "uses_llm": false,
    "model_attached": false,
    "model": null,
    "portable_to": [
      "Hermes Agent cron in no-agent mode",
      "Windows Task Scheduler",
      "system cron or launchd after adapting local paths"
    ]
  },
  "inputs": [
    "authenticated currently-reading shelf",
    "annotated-book discovery and post-write detail metadata",
    "authenticated recent-comments metadata",
    "prior hashed/count state"
  ],
  "outputs": [
    "every current title",
    "exact new highlight/note counts",
    "idempotent publish-all sweep receipt",
    "comments count/delta without bodies"
  ],
  "risk": {
    "level": "account-write",
    "confirmation": "standing approval limited to idempotently making every discovered annotated book visible before post-write diff/verification"
  },
  "verification": [
    "shelf parsed count equals declared count and every title is non-null",
    "every discovered annotated book receives the idempotent visible=true write before detail diffing",
    "every annotated book detail is inspected after the write",
    "post-write visible count equals annotation count",
    "comment output contains no body fields",
    "state updates are atomic"
  ],
  "logging": {
    "receipt": "one bounded per-run receipt",
    "retention": "operator-defined local retention",
    "business_verification_required": true
  },
  "failure_policy": {
    "deliver_every_run": true,
    "mode": "partial-fail-loud",
    "never_infer_success": true
  },
  "secrets_policy": "session cookies and CSRF remain local; public output is counts/titles only",
  "output_format": {
    "delivery": "Telegram Markdown",
    "template": "output.md",
    "exact_contract": true,
    "always_reports": true
  },
  "limitations": [
    "The actual collector script and account session are private, so this is a contract and output template, not a one-command install.",
    "Kindle highlights can take time to appear in Goodreads; no Goodreads-visible change is not proof that no highlight was made.",
    "Do not suppress the idempotent visible=true sweep from pre-write count equality; Goodreads can expose additional imported/private rows only after the write.",
    "Publicizing annotations is an account write and only makes sense with explicit standing approval."
  ],
  "copying": {
    "ready_to_run": false,
    "requires": [
      "a Goodreads session cookie stored outside the repo",
      "the private collector script or your own replacement",
      "a local state directory with atomic writes",
      "an explicit decision on annotation publicizing"
    ]
  }
}
